NGRAM,VALUE,
too big to fail,52.28762523605066
Conditio sine qua non,51.70266273532951
Strategische Immobilien Verwertungs- Beratungs-,49.70266273532951
Future Business Austria Infrastrukturreport,48.317998885094184
Sonja Steßl zugunsten Staatssekretariats,48.00222301718841
Steter Tropfen höhlt Stein,47.965697141163304
Best Point of Service,47.605801196076925
Absetzbarkeit privater Kunst- Kulturausgaben,47.243231116692215
privater Kunst- Kulturausgaben bewirken,46.8953078132719
internen IT-Infrastruktur BIFIE gespeichert,46.79577213972099
erweiterte Absetzbarkeit privater Kunst-,46.65826861597105
erweiterte steuerliche privater Kunst-,46.31034531255075
Kriminaltourismus schnellst temporäre Grenzkontrollen,46.228731546997096
erweiterte steuerliche Absetzbarkeit privater,46.02083869535576
Böse Zungen behaupten hartnäckig,45.965697141163304
Geschäftsräumen geschlossene Verträge erlassen,45.76406327999365
Klubdirektor Parlamentsrat Mag Norbert,45.42137662493949
Parlamentsrat Mag Norbert Nemeth,45.42137662493949
Geldwäscherei- Terrorismusfinanzierungsrisiko-Verordnung Staaten aufgelistet,45.39280747274272
Landgut Allacher GmbH Gols,45.151915949946265
Schere zwischen Lehrstellenangebot Lehrstellensuchenden,45.066038114785854
Übergangsbestimmungen einzelne Herkunftsländer geschaffen,44.98080403355351
erweiterte steuerliche Absetzbarkeit Kunst-,44.850913693913455
außerhalb Geschäftsräumen geschlossene Verträge,44.516135766550065
steuerliche Absetzbarkeit privater Kunst-,44.4358761946346
F & E- Quote,44.0879528912143
F & E- Quoten,44.02083869535576
privaten Sponsorings zeitgenössischer Kunst,43.5563062050256
schnellst temporäre Grenzkontrollen durchzuführen,43.528291828856005
Förderung privaten Sponsorings zeitgenössischer,43.42137662493949
wichtigste Einnahmequelle Staates überholen,43.368761998776066
Mag Sonja Steßl zugunsten,43.35836682741369
Ehe zwischen getrenntgeschlechtlichen Partnern,43.329072520619654
weiters Möglichkeit zeitlicher Befristungen,42.956708357936044
tatsächlichen Lebenshaltungskosten jeweiligen Herkunftsland,42.943329328134844
Sponsorings zeitgenössischer Kunst Kultur,42.91476017593807
Kriminaltourismus schnellst möglich temporäre,42.91258580470374
Kooperationsmöglichkeiten zwischen Pädagogischen Hochschulen,42.84364569344941
Zungen behaupten hartnäckig Faymann,42.7692999283598
Sonja Steßl eines Staatssekretariats,42.68864226501457
bei Elementarereignissen Unglücksfällen außergewöhnlichen,42.4810756140647
geheim hinter verschlossenen Türen,42.41034110252747
einen wirtschafts- finanzpolitischen Super-GAU,42.38675842806991
schriftlich eingereichte Anfrage /M,42.15834221910569
automatische jährliche Wertanpassung Freibeträge,42.14042031110843
Form weitgehender Autonomie ausgeübt,41.918027889771984
Spindelegger blumigen Worten dargelegt,41.90770541840412
gesetzliche Verankerung jährlichen Anpassung,41.866261658246884
Gesetzesentwurf vorzulegen welcher verfassungsrechtlich,41.785788051148366
Abschaffung Luxuspensionen inklusive Luxuspensionskassenregelungen,41.623252028935426
Sonja zugunsten eines Staatssekretariats,41.57316504759464
automatische jährliche Wertanpassung Pflegegeldes,41.488343614528745
Wissenschaft humboldtschen Sinn vernachlässigt,41.4859168771342
als tickende Zeitbomben herumlaufen,41.48188136389904
Hilfeleistung bei Elementarereignissen Unglücksfällen,41.4810756140647
Doris Bures Als Nächster,41.40528787480119
Kriminaltourismus schnellst möglich Grenzkontrollen,41.268729614929015
nunmehrige Teillösung einer Gläubigerbeteiligung,41.268729614929015
Staatssekretärin Mag Sonja Steßl,41.17616349619294
meiner Verwunderung Ausdruck verleihen,41.148926792361834
Agrarmarkt Austria Marketing GmbH,41.0891801945983
Structure follows strategy —,41.0670453724131
Vignettenpflicht bis Kufstein Süd,40.971343704304445
aufschiebende Wirkung eines Rechtsmittels,40.881287342956966
Schleppertätigkeit dem Kriminaltourismus schnellst,40.83366874747952
internen IT-Infrastruktur des gespeichert,40.77192539776662
Täglich grüßt das Murmeltier,40.72458789471163
schwache Innovationsfähigkeit unseres Landes,40.65009468452535
Heinz-Christian Strache Herbert Kickl,40.62584713827867
Steßl zugunsten eines Staatssekretariats,40.573165047594635
Luxuspensionen inklusive Luxuspensionskassenregelungen öffentlichen,40.50507060258711
/- bis /- jährigen,40.46319680063412
 CLAUDIA UND MARIA,40.34839804603146
dauerhaften Datenträger bereitzustellen ,40.34839804603146
B-VG durch ausdrückliche Entschließung,40.32039897721467
schnellst möglich temporäre Grenzkontrollen,40.26872961492902
Verwunderung darüber Ausdruck verleihen,40.24962079198131
schnellst möglich temporäre durchzuführen,40.21214608656265
B-VG über bundesweite Bedarfsorientierte,40.085603474053286
Abgeordneter Durchführung temporärer Grenzkontrollen,40.08152662205487
betreffend sofortige Auflösung SIVBEG,39.994872239800685
aller Luxuspensionen inklusive Luxuspensionskassenregelungen,39.99211934678134
Sonja Steßl zugunsten eines,39.98820254687348
Definition des qualifizierten Privatkunden,39.94185039920893
nunmehrige Teillösung mit Gläubigerbeteiligung,39.93871270006447
Doris Bures Als Nächste,39.90278753427201
die White Star Line,39.89200184975837
österreichischen Gerichten rechtskräftig abgewiesen,39.87155345997249
Verbot Verschleierung des Gesichtes,39.85438755795859
Kriminaltourismus möglich temporäre Grenzkontrollen,39.853692115650176
dem Kriminaltourismus schnellst temporäre,39.83366874747952
Durchführung temporärer Grenzkontrollen Nationalrat,39.759598527167505
Schlag Gesicht aller Soldaten,39.73669812505742
Matznetter heraußen Dr Fellner,39.702134501342684
betreffend Durchführung temporärer Grenzkontrollen,39.67294414491332
etwas faul Staate Dänemark,39.63492961809213
das ineffiziente überbürokratisierte Sozialversicherungssystem,39.55466289326932
Steter Tropfen höhlt den,39.515585644506835
Elementarereignissen und Unglücksfällen außergewöhnlichen,39.5154137743787
Absetzbarkeit von Mietvertragserrichtungskosten Maklerprovisionen,39.462964768161825
tagein tagaus ihr Leben,39.453401108729665
gleicher Lohn gleiche Arbeit,39.42944992547517
Dritten Präsidenten Norbert Hofer,39.40847279170885
Schlag ins Gesicht Soldaten,39.39446593371497
Opposition feierte neue Revolution,39.35688789848778
Blog  CLAUDIA UND,39.34839804603146
eklatanter Widerspruch zwischen Zielen,39.32907252061965
Abschaffung aller inklusive Luxuspensionskassenregelungen,39.27842353193799
Landgut Allacher aus Gols,39.200514658271956
steigenden Schleppertätigkeit dem Kriminaltourismus,39.13322902933842
wirtschafts- und finanzpolitischen Super-GAU,39.100376275099855
One Way Richtung Europa,39.026607723166634
Anmeldevorschriften für Familienangehörige Gastronomiebetrieben,39.01179172603719
müssen Gürtel enger schnallen,39.005212460206366
notwendigen budgetären Vorkehrungen treffen,38.95782889782996
Schere Lehrstellenangebot und Lehrstellensuchenden,38.93045127365754
Verwertungs- Beratungs- und EntwicklungsgesmbH,38.93045127365754
Folgejahren Pensionsanpassung aller Pensionen,38.90662312649974
die Ferne schweifen Sieh,38.89200184975837
unseres Dritten Norbert Hofer,38.8833817469651
Abschaffung aller Luxuspensionen Luxuspensionskassenregelungen,38.88249485560684
Abgeordneten DDr Hubert Fuchs,38.86779669696749
Nationalrat schnellstmöglich Gesetzesentwurf vorzulegen,38.840929605340826
zwischen Pädagogischen Hochschulen Universitäten,38.75618285219907
durch erweiterte steuerliche Absetzbarkeit,38.73543647649351
passive Wahlrecht für Drittstaatsangehörige,38.72228510884221
welcher verfassungsrechtlich tatsächliche Abschaffung,38.701254540936695
zugunsten eines Staatssekretariats Verwaltungsreform,38.69869592967849
Exekutivbedienstete in polizeilichen Grundausbildung,38.68689924795963
B-VG ausdrückliche Entschließung des,38.67506385851404
Sichtbarmachung Sammlung der Artothek,38.65270077091557
Sichtbarmachung der Sammlung Artothek,38.65270077091557
betreffend steuerliche Absetzbarkeit Kunst-,38.6349762947143
dass einschlägig vorbestrafte Sexualstraftäter,38.62209500341757
solides Fundament stellen frei,38.613115702590534
durch ausdrückliche Entschließung Nationalrates,38.60990559440966
Steter höhlt den Stein,38.60869504889832
völlig ungeschwärzt lediglich versehen,38.608420066520495
schnellst möglich Grenzkontrollen durchzuführen,38.568289896787924
bundeseinheitliche Mindestsicherung derzeit geregelt,38.540481237863915
Übergangsbestimmungen für einzelne Herkunftsländer,38.53786053770478
Hilfeleistung Elementarereignissen und Unglücksfällen,38.5154137743787
a B-VG über bundesweite,38.500640973332125
zur Abfederung kalten Progression,38.45020261903667
IT-Infrastruktur des BIFIE gespeichert,38.449997302879254
Steuerabkommen dem Fürstentum Liechtenstein,38.44135132470076
aufgefordert ehestmöglich entsprechende Regierungsvorlagen,38.43236740885747
regelmäßige Anpassung Tarifstufen an,38.36927441044577
Objektes Roßauer Lände ,38.34839804603146
save the taxpayer ,38.34839804603146
späteste Prüfmöglichkeit  Förderjahr,38.34839804603146
allgemeine Wehrpflicht wesentlichen Beitrag,38.339851339880845
sofortige Auflösung SIVBEG Der,38.30391904339132
des privaten Sponsorings zeitgenössischer,38.29799420943421
Geldwäscherei- und Terrorismusfinanzierungsrisiko-Verordnung aufgelistet,38.29302135304225
Finanzminister Spindelegger blumigen Worten,38.27543720290461
ausgebildeter Blindenführhund ein verlässlicher,38.27417169999726
das Rule of Law,38.26515627607433
B-VG eine bundesweite Bedarfsorientierte,38.18508902705178
Neuen Wiener Schule Nationalökonomie,38.171078207033155
denen jedenfalls erhöhtes Risiko,38.16241358908388
gemäß Art a B-VG,38.161969614610186
Abgabenerhöhung belastet heimischen Steuerzahler,38.110049975136036
Schleppertätigkeit und Kriminaltourismus schnellst,38.10037627509986
Fernabsatz- außerhalb von Geschäftsräumen,38.089506372634375
über bundesweite Bedarfsorientierte Mindestsicherung,38.085603474053286
ordentliche Steuer- Strukturreform fehlt,38.07796880264168
Exekutivbedienstete der polizeilichen Grundausbildung,38.06773827019441
beklagten Verlust an entgegenzuwirken,38.042109667192264
tatsächliche Abschaffung Luxuspensionen inklusive,38.038289528214264
Oktoberheft  Weiter Geldverbrennen,38.026469951144094
meiner Verwunderung darüber verleihen,38.0218148744585
Ungeheuer von Loch Ness,38.015505791190606
Erleichterungen Anmeldevorschriften für Familienangehörige,38.01179172603719
entsprechender Absatzmarkt Kunden vor,37.98992080825377
Durchführung temporärer Grenzkontrollen Der,37.98199094850395
Übergangsbestimmungen für Herkunftsländer geschaffen,37.933789214035926
eines Lohn- Sozialdumpingfalls erfasst,37.93375476285111
 Structure follows strategy,37.933360546752624
eine erweiterte Absetzbarkeit privater,37.92205462121798
wichtigste Einnahmequelle des überholen,37.89745627985048
Steßl zugunsten Staatssekretariats für,37.89631450861726
Absetzbarkeit von haushaltsnahen Dienstleistungen,37.878002267440664
Steuerabkommen mit Fürstentum Liechtenstein,37.86832337217308
Eine Ergänzung meinerseits Leider,37.86651373108401
Bundesamtes für Verfassungsschutz Terrorismusbekämpfung,37.85978863259215
weiterer Abgeordneter sofortige Auflösung,37.80850812764845
sowie Schlag ins Gesicht,37.75703601309968
Landgut GmbH aus Gols,37.72658346993954
Stellungnahme Europäischen Gerichtshofes warten,37.691435479906254
noch geheim verschlossenen Türen,37.68960182277584
Anmeldevorschriften Familienangehörige in Gastronomiebetrieben,37.68689924795963
Absetzbarkeit Mietvertragserrichtungskosten und Maklerprovisionen,37.64094465646256
möchten keine Schwangerschaft Probe,37.63207587932243
verfassungsrechtlich tatsächliche Abschaffung aller,37.61946044977305
einer verfassungswidrigen Verordnung erlassen,37.61337778631646
Umsatzsteuer als wichtigste Einnahmequelle,37.60741224598291
österreichischen Sicherheits- Verteidigungspolitik sowie,37.5820468427775
eine erweiterte steuerliche privater,37.57413131779768
ehestmöglich entsprechende Regierungsvorlagen Nationalrat,37.551011905356084
weiterer Abgeordneter Durchführung temporärer,37.54547372181466
weitgehender Autonomie ausgeübt wird,37.54547372181466
zugleich ihr Zögling gar,37.53866371310259
Wortfolge des dritten Buches,37.52399788432304
Erbschafts- und Schenkungssteuer überfallsartig,37.5154137743787
Immobilien Verwertungs- Beratungs- und,37.5154137743787
Untersuchungsausschüsse Nationalrates völlig ungeschwärzt,37.48288918443663
Handlungsfreiheiten Handlungsmöglichkeiten des Staates,37.482418780571635
Verteidigungspolitik sowie Schlag ins,37.4675293959047
Entschließungsantrag Abgeordneten Carmen Schimanek,37.454301362497056
internen IT-Infrastruktur des BIFIE,37.44999730287926
Abgeordneten Heinz-Christian Strache Herbert,37.39831141366627
faul im Staate Dänemark,37.394070889095374
Lage zusätzliche Mittel aufzubringen,37.36535056412693
Als Nächster Wort gemeldet,37.34917127041819
 Täglich grüßt Murmeltier,37.34839804603146
Future Business Infrastrukturreport ,37.34839804603146
Plakate  Dieter Erlacher,37.34839804603146
Täglich grüßt Murmeltier ,37.34839804603146
bekanntermaßen  Structure follows,37.34839804603146
zulässigen Dienstdauer auf maximal,37.34242528354467
Christian Hafenecker weiterer Abgeordneter,37.32308130047821
des Medienkooperations- und- förderungs-Transparenzgesetzes,37.312493779129326
die Strategische Immobilien Verwertungs-,37.307039349037225
gesamten strukturellen Steuerreform zuzuleiten,37.290651633820616
des Sponsorings zeitgenössischer Kunst,37.269425057237434
das passive Wahlrecht Drittstaatsangehörige,37.265156276074336
jahrelange wirtschaftspolitische Forderung Freiheitlichen,37.251451623497175
Bundesamt für Fremdenwesen Asyl,37.239202222140264
trotz geplanten budgetären Einsparungen,37.234961670993044
Bundesgesetz über Fernabsatz- außerhalb,37.22671825135559
ein erhöhtes Risiko Geldwäscherei,37.19616918799599
Abgeordneter betreffend sofortige Auflösung,37.18751731774308
eine regelmäßige Anpassung Tarifstufen,37.185089027051774
 ermittelten fremden tatverdächtigen,37.178473044589154
Konrad Paul Liessmann ,37.178473044589154
Paul Liessmann  Theorie,37.178473044589154
möglich temporäre Grenzkontrollen durchzuführen,37.153252397509085
Verbot der Verschleierung Gesichtes,37.15020043038639
Förderung des Sponsorings zeitgenössischer,37.134495477151326
außerhalb von Geschäftsräumen geschlossene,37.089506372634375
 Wohnungseigentumsgesetz pauschal ausnimmt,37.026469951144094
Albert Einstein untermauern ,37.026469951144094
Nationalrates völlig ungeschwärzt lediglich,37.02345756579933
Die Stiftung Fürst Liechtenstein,37.02177825581937
weiterer betreffend sofortige Auflösung,36.98488815122806
temporäre Grenzkontrollen durchzuführen Werte,36.97370297717836
unkontrollierten Migration von Flüchtlingen,36.97111167183215
Beschlüsse des Südtiroler Landtags,36.964570475709024
ausdrückliche Entschließung des Nationalrates,36.964570475709024
gegen geplante totale Rauchverbot,36.94473889838952
Pleiten Pech und Pannen,36.93045127365754
privater Kunst- und Kulturausgaben,36.93045127365754
Abgeordneter betreffend Durchführung temporärer,36.924482911909294
Einschränkungen der Handlungsfreiheiten Handlungsmöglichkeiten,36.915735176749365
Kultur durch erweiterte steuerliche,36.90946587626856
funktionierender Rechtsstaat ein staatliches,36.899776185215764
Präsidentin Doris Bures Als,36.89749323460248
Umsatzsteuer wichtigste Einnahmequelle des,36.89745627985048
 rule of law,36.888966427394166
rule of law ,36.888966427394166
Allacher GmbH aus Gols,36.87858656338459
internen des BIFIE gespeichert,36.8650348021581
Banken vor unliebsamer Konkurrenz,36.85867627497552
der Kooperationsmöglichkeiten Pädagogischen Hochschulen,36.84534584885796
Dr Georg Springer seiner,36.81815829768217
von Geschäftsräumen geschlossene Verträge,36.81387193002095
den Gürtel enger schnallen,36.801340126840714
Einschränkungen Handlungsfreiheiten und Handlungsmöglichkeiten,36.77844818021249
 Equal Pay Day,36.7634355453103
Südafrika  Uganda Uruguay,36.7634355453103
Südafrika Uganda  Uruguay,36.7634355453103
der Vignettenpflicht Kufstein Süd,36.74581017530705
weiterer betreffend Durchführung temporärer,36.72185374539427
Kooperationsmöglichkeiten Pädagogischen Hochschulen und,36.708058852321095
mehr vollem Umfang erfüllt,36.707523730773104
bundesweite Bedarfsorientierte Mindestsicherung auf,36.69034858696497
künftige Finanzierung des Verkehrs,36.68446255651628
Sozialdumpingfalls erfasst wird zugunsten,36.65238892573117
Dr Walter Rosenkranz Kunasek,36.6506042007026
Absetzbarkeit privater und Kulturausgaben,36.64094465646255
gegenseitige Amtshilfe in Steuersachen,36.628005558906054
schmutzige Geschäft mit Abtreibung,36.616784605177116
Steter Tropfen den Stein,36.60869504889832
Tropfen höhlt den Stein,36.60869504889832
a B-VG eine bundesweite,36.60012652633063
Hubert Fuchs weiterer Abgeordneter,36.59992150583703
Schlag ins Gesicht aller,36.57570624838512
Mitspracherecht beim weiteren Vorgehen,36.57552818496312
 migration & integration,36.54104312397386
migration & integration ,36.54104312397386
meiner Kollegin Anneliese Kitzmüller,36.54042877717988
gute Übersicht über eingebrachten,36.52266727966213
Zwang lehnen prinzipiell ab,36.50923576864377
weiters die zeitlicher Befristungen,36.49968442697961
Leben lang hart gearbeitet,36.49269540976526
Gehaltsunterschied zwischen Frauen Männern,36.47233576450054
Polizeidienststelle Spital am Semmering,36.45425331647574
sollte weiters Möglichkeit zeitlicher,36.44891371773735
Als Nächste Wort gelangt,36.43163343061016
