NGRAM,VALUE,
last but not least,48.65732185441505
There is no alternative,47.709789274309195
Doris Bures Als Nächster,41.6981478678738
Verhinderung Störung einer Versammlung,40.887129931745704
Verhinderung oder Störung Versammlung,40.716221833133574
protokollarische Wortlaut zum TOP,39.98035735282839
Einen schönen guten Morgen,39.78695713483165
möglichst getreuen Darstellung finanziellen,38.77006496708805
Bruno Rossmann Werner Kogler,38.63780558581517
gesetzliche Verankerung eines Stufenplans,38.3892707496765
Verankerung eines Stufenplans Erhöhung,37.78660624722188
Besteuerung des Eigenverbrauchs Strom,37.463268582079856
gesetzliche Verankerung Stufenplans zur,37.452696129818136
Präsidentin Doris Bures Als,37.45211988734571
et cetera et cetera,37.43421823601447
größten Finanzskandal Zweiten Republik,37.26868947844416
Beträge für Auszahlungen fix,37.00080122326968
Abgeordneten Mag Christiane Brunner,36.98561231252815
Verankerung Stufenplans zur Erhöhung,36.85003162736352
Entschließungsantrag Abgeordneten Tanja Windbüchler-Souschill,36.488806423227416
der protokollarische Wortlaut TOP,36.43638217517561
Besteuerung Eigenverbrauchs von Strom,36.39413650484832
Addis Abeba stattfindenden ,36.32286586411672
Einführung einer Goldenen Regel,36.12159518538273
Spalte BVA die Beträge,35.719665608097415
Entschließungsantrag Abgeordneten Eva Glawischnig-Piesczek,35.658731424669725
 Stop the boats,35.492790865559044
Stop the boats ,35.492790865559044
Abgeordneten Bruno Rossmann Werner,35.327465465203026
Abgeordneten Tanja Windbüchler-Souschill Kolleginnen,35.30438185208999
Licht ins Dunkel bringen,35.26359623724349
Tropfen auf heißen Stein,35.22567968195624
 Too big to,34.90782836483788
big to fail ,34.90782836483788
Abeba stattfindenden  Internationalen,34.907828364837876
neun Landesräte und Landesrätinnen,34.72605009860116
Ist Herr Roman Söllner,34.71349451741173
das Frauenpensionsantrittsalter vorzeitig anheben,34.708381079916386
 There no alternative,34.49279086555904
There no alternative ,34.49279086555904
Verehrte Gäste auf Galerie,34.44103611264556
Verlangen Einsetzung eines Untersuchungsausschusses,34.4202026092284
 There is no,34.32286586411672
wahrsten Sinne des Wortes,34.30299375067128
Recht einen angemessenen Lebensstandard,34.213212858267944
Mare Nostrum II als,34.19511174363347
Betrag für Nettofinanzierungsbedarf -,34.12305697332067
Entwicklung gesetzliche Verankerung eines,34.11128600237673
sowie Betrag für Nettofinanzierungsbedarf,34.09391062766116
zur gefährlichsten Grenze Welt,33.96103734893637
There is no ,33.90782836483788
stattfindenden  Internationalen Konferenz,33.907828364837876
Angst Schrecken zu verbreiten,33.872457005662014
historische Zäsur im Parlamentarismus,33.707233049906314
Verankerung eines Stufenplans zur,33.66842482087357
meine Kollegin Christiane Brunner,33.66100179658747
größte Menschenrechtsorganisation des Landes,33.66075221695863
eine historische Zäsur Parlamentarismus,33.660392372873545
is no alternative ,33.644793959004105
gut- und besserverdienenden Familien,33.64358793840918
Goldenen Regel für Investitionen,33.61077561199891
Entschließungsantrag Abgeordneten Bruno Rossmann,33.511890036340475
protokollarische Wortlaut TOP ,33.49279086555904
Recht auf angemessenen Lebensstandard,33.4772184489522
die gut- besserverdienenden Familien,33.45663120226362
Forstwirtschaft Umwelt und Wasserwirtschaft,33.38306038818597
 There is alternative,33.32286586411672
There is alternative ,33.32286586411672
als größte Menschenrechtsorganisation Landes,33.29948597412077
im wahrsten Sinne Wortes,33.292912595891195
und gesetzliche Verankerung Stufenplans,33.27726572416337
Spalte BVA  Beträge,33.170862770671675
Entschließungsantrag Abgeordneten Dr Walser,33.15592802877951
Polizei als größte Menschenrechtsorganisation,33.13463196222589
engagiertes Umwelt- und Energieministerium,33.13168889987776
und engagiertes Umwelt- Energieministerium,33.13168889987776
Verhinderung oder Störung einer,33.1044592730687
oder Störung einer Versammlung,33.1044592730687
sowie weitere Gesetze geändert,33.04125511081881
Bundesminister für Land- Forstwirtschaft,32.97311634633254
 is no alternative,32.90782836483788
Land- und Forstwirtschaft Umwelt,32.89763356101572
BGBl  I Nr,32.848934675784314
BGBl I Nr ,32.848934675784314
Ziffer a eingefügt ,32.62242614597563
Angst und Schrecken verbreiten,32.473662936966875
Mord  Vergewaltigung Vertreibung,32.46304352216498
eigenständiges starkes und engagiertes,32.42119551707274
gesetzliche eines Stufenplans zur,32.372968937347395
Verhinderung oder einer Versammlung,32.36749367890249
Einsetzung eines Untersuchungsausschusses Minderheitsrecht,32.36130892017482
Polizei größte Menschenrechtsorganisation des,32.34389511161869
starkes und engagiertes Umweltministerium,32.3057182996528
Verehrte Gäste der Galerie,32.270916821924
der Betrag Nettofinanzierungsbedarf -,32.236709830339244
sowie der Betrag Nettofinanzierungsbedarf,32.20756348467973
Beträge  Auszahlungen fix,32.170862770671675
Werner Schlager Academy ,32.17086277067167
Vereinbarkeit von Familie Beruf,32.094928486461036
a eingefügt  a,32.09191142927685
Mord Vergewaltigung  Vertreibung,32.04800602288614
Bures Als Nächster zu,32.03074060066893
starkes engagiertes Umwelt- und,32.02887809429399
starkes und engagiertes Umwelt-,32.02887809429399
Frau Präsidentin Guten Morgen,32.02704118454575
kein Datenleck beim BIFIE,32.00950610709234
Abgeordneten Dr Walser Kolleginnen,31.971503457642086
unabhängig von irgendwelchen wirtschaftlichen,31.90228340851864
entsprechenden Rubrik der Untergliederung,31.889487715287977
ein schiefes Licht bringen,31.876314404362027
eines Stufenplans zur Erhöhung,31.77030443489278
Verlangen auf Einsetzung Untersuchungsausschusses,31.686148610482093
verlängerte Werkbank der Regierung,31.659400902161522
% - Ziels und,31.554946905961565
Frau Finanzministerin außer Dienst,31.543713534719693
getreuen Darstellung der finanziellen,31.536186232141098
Entlastung des Faktors Arbeit,31.522000845783218
zur Entlastung Faktors Arbeit,31.462713108488487
klein- und mittelständischen Unternehmungen,31.436302409462954
Gutachten von Professor Öhlinger,31.43220454568184
schiefes Licht zu bringen,31.42767216298911
Kampf gegen Gewalt Frauen,31.415634239527485
entscheidenden Schritt nach vorne,31.396293406762858
Doris Bures  Nächster,31.377313648139108
größten Finanzskandal der Zweiten,31.348919333925267
gesetzliche Verankerung eines zur,31.23546541359746
bis einem gewissen Grad,31.207388646696792
möglichst getreuen Darstellung der,31.16803512049308
Akt der strukturellen Verantwortungslosigkeit,31.155096064785596
wie folgt geändert Artikel,31.120562408989294
Ausbau des öffentlichen Verkehrs,31.10132480834463
Der Nationalrat wolle beschließen,31.086219740455533
Entschließungsantrag der Tanja Windbüchler-Souschill,30.99967063303839
Nationalrat einen Gesetzesentwurf vorzulegen,30.881016427926752
Bundesminister Land- und Forstwirtschaft,30.87893746730584
die verlängerte Werkbank Regierung,30.84957493069185
Kollegen Verehrte Gäste auf,30.837214584673085
Wissenschaftsministerium als eigenständiges Ministerium,30.82948918752013
keine Lohn- Einkommensteuer zahlen,30.733622971119985
Forstwirtschaft  Umwelt Wasserwirtschaft,30.647300814614653
Verankerung eines zur Erhöhung,30.632800911142844
Nationalrat einen Budgetentwurf vorzulegen,30.61798202209296
geht um Steuerzahlerschutz versus,30.60645972185293
getreuen Darstellung der Lage,30.536186232141098
finanziellen Lage des Bundes,30.517629668284172
Geschätzte Herren Geschätzte Zuseherinnen,30.50963992664458
klein- und mittelständische Unternehmungen,30.488769829357082
Daham statt Islam ,30.433897176505468
auf einen angemessenen Lebensstandard,30.431853144743286
der Abgeordneten Tanja Windbüchler-Souschill,30.411796536897356
die klein- mittelständischen Unternehmungen,30.401348766762446
engagiertes Umwelt- Energieministerium ,30.395929326306458
ein Fass ohne Boden,30.37684812392247
Bundesminister für Landesverteidigung Sport,30.361681634250168
Die Regierungsvorlage betreffend Bundesgesetz,30.33012605634285
Guten Morgen Herr Minister,30.286271479684757
dem Nationalrat Gesetzesentwurf vorzulegen,30.262657605983023
dem Nationalrat Budgetentwurf vorzulegen,30.262657605983
Darstellung finanziellen Lage des,30.19570157339681
Tanja Windbüchler-Souschill Kolleginnen und,30.19237682657686
Vereinbarkeit Familie und Beruf,30.192376826576854
bleibt nichts anderes übrig,30.17213386422825
Geschätzte Zuseherinnen Zuseher vor,30.17131739350655
Entschließungsantrag der Eva Glawischnig-Piesczek,30.169595634480707
Land- Forstwirtschaft  Umwelt,30.161873987444416
Nationalrat einen Gesetzesvorschlag vorzulegen,30.158550403455656
Sehr geehrte Zuseherinnen Zuseher,30.12782920512977
Hypo Real Estate ,30.100473442780277
Ein weiterer wichtiger Punkt,30.098679068485154
im wahrsten des Wortes,30.09563542268169
Ausbau der erneuerbaren Energien,30.074438401440368
gefährlichsten Grenze der Welt,29.99343867932688
dringend ein eigenständiges starkes,29.975850077912952
Arbeit Soziales und Konsumentenschutz,29.915667483845986
Entschließungsantrag Nationalrat wolle beschließen,29.823493899491034
humanitäre Hilfe im Ausland,29.81294249107743
dem Nationalrat Gesetzesvorschlag vorzulegen,29.803225987345698
Österreich um Asyl angesucht,29.78694259344632
bin der festen Überzeugung,29.774010497868034
fällt nie ein Name,29.766794642238487
des Eigenverbrauchs von Strom,29.714656405342872
Was ist protokollarische Wortlaut,29.713521765063476
der protokollarische zum TOP,29.706950253694806
Einführung  Goldenen Regel,29.668362430142494
unsere Grund- und Freiheitsrechte,29.654482579512482
möglichst getreuen der finanziellen,29.648660961399514
des Bundesministeriums für Inneres,29.643249218651597
Nationalrat einen Gesetzentwurf vorzulegen,29.61798202209296
der Abgeordneten Eva Glawischnig-Piesczek,29.581721538339664
eigenständiges  starkes engagiertes,29.578520739584924
 starkes engagiertes Umweltministerium,29.569958726081495
Haftungen des Landes Kärnten,29.540089682586014
für Hypo Alpe Adria,29.53809447259954
an einem Strang gezogen,29.518305489196692
und Verankerung eines Stufenplans,29.492994415218803
Bis zum heutigen Tag,29.476090086125026
die meisten Gewinne schreiben,29.462277765404757
bringe daher folgenden Antrag,29.41074227997933
Finanzdebakel der Zweiten Republik,29.410319878589405
Finanzskandal der Zweiten Republik,29.410319878589405
Verkehr Innovation und Technologie,29.391448173678683
Was der protokollarische Wortlaut,29.38653362572505
 Summe Auszahlungen jeweils,29.32286586411673
Summe Auszahlungen  jeweils,29.32286586411673
Summe Auszahlungen jeweils ,29.32286586411673
starkes engagiertes Umweltministerium ,29.306924320247717
Sehr geehrte Zuschauer Zuschauerinnen,29.30269958134418
Fassung des Berichtes des,29.29836165540418
Betrag Nettofinanzierungsbedarf - ,29.293118520722672
Werte Zuschauerinnen Zuschauer vor,29.286140386051024
dem Nationalrat Gesetzentwurf vorzulegen,29.262657605983
Antrag Einsetzung eines Untersuchungsausschusses,29.239630363586592
 % - Ziels,29.234224831669103
Freundinnen und Freunde betreffend,29.21069810722439
Kampf Gewalt an Frauen,29.200229719804952
braucht ein eigenständiges starkes,29.1445105153116
vom Klimawandel betroffen sein,29.143711073458668
geordnete Insolvenz anzustreben ,29.137195057906276
Daher bringe folgenden Antrag,29.105887698450907
 starkes engagiertes Umwelt-,29.100473442780284
 Einen schönen Morgen,29.100473442780277
Einen schönen Morgen ,29.100473442780277
folgenden Antrag einbringen Entschließungsantrag,29.086079217370717
der Abgeordneten Eva Mückstein,29.067148365509887
aufgefordert dem Nationalrat umgehend,29.055695225216162
Doris Bures  Als,29.048190051847556
Besteuerung des Eigenverbrauchs von,29.036584500230234
Nationalrat bis Ende September,29.022994690102557
Doris  Als Nächster,29.011664175822418
historische Zäsur Parlamentarismus ,29.009870893999377
Entwicklung und gesetzliche Verankerung,28.999280976863602
Liebe Zuschauerinnen und Zuschauer,28.99913075089993
entsprechenden Rubrik  Untergliederung,28.945896405671405
Regierungsvorlage betreffend ein Bundesgesetz,28.932603535208585
Lasten gerecht verteilen ,28.93054844133797
das anhand eines Beispiels,28.890246319105543
einer Goldenen Regel für,28.886538322675626
und Kollegen Verehrte Gäste,28.874301057185093
ist protokollarische Wortlaut zum,28.86401339159093
Einsetzung eines Untersuchungsausschusses zur,28.851359773870527
Verlangen auf Einsetzung eines,28.81941514134556
 Goldenen Regel Investitionen,28.780837159400903
Goldenen Regel Investitionen ,28.780837159400903
Antrag des Teams Stronach,28.761095896714302
wolle beschließen Die Regierungsvorlage,28.708775875395396
Besuchergalerie vor den Bildschirmen,28.69478038191732
wage ich zu bezweifeln,28.682754445432508
ist Fass ohne Boden,28.64919418995928
möglichst Darstellung der finanziellen,28.648660961399514
Gewalt an Frauen Mädchen,28.638350832196835
Als Nächster zu Wort,28.62265586203185
Präsidentin Meine geschätzten Damen,28.60267438778569
Tribüne vor den Fernsehapparaten,28.601670977525842
bei all jenen bedanken,28.599452956189943
Kampf gegen Gewalt an,28.57874134305868
der Deutschen Bank Luxemburg,28.575596939466024
Nationalrat wolle beschließen Die,28.561218686981547
Mag  Christiane Brunner,28.552885212722558
Mag Christiane Brunner ,28.552885212722558
auf Einsetzung eines Untersuchungsausschusses,28.53930722215282
der Wortlaut zum TOP,28.537025252252498
der protokollarische Wortlaut zum,28.537025252252498
geschätzten Damen Herren Abgeordnete,28.524139496339693
aus welchen Motiven immer,28.52357184138809
Leiterin der Staatsanwaltschaft Wien,28.494030584978645
insbesondere Bundesministerin für Inneres,28.436556446137452
 Mare Nostrum II,28.433897176505468
auf der Zunge zergehen,28.42620377115508
bis zu gewissen Grad,28.41034609907532
die Entwicklung gesetzliche Verankerung,28.397286741439196
Verlangen auf eines Untersuchungsausschusses,28.394917312817647
Österreich Asyl angesucht haben,28.394752791972515
zu einem gewissen Grad,28.384425620284745
Geschätzte Zuseherinnen Zuseher auf,28.365710133735213
im Besitz des Bundes,28.358669828515488
das Wissenschaftsministerium eigenständiges Ministerium,28.34275852380304
geehrte Gäste auf Galerie,28.337748304233536
der Hypo Alpe Adria,28.329819234730735
größten Finanzskandal der Republik,28.327857718397432
Meine geschätzten Damen Herren,28.318881421785107
Europa Integration und Äußeres,28.304232771763644
als größte Menschenrechtsorganisation des,28.282970887337747
Entlastung der Lohn- Einkommensteuer,28.276615933647008
eines Untersuchungsausschusses zur Untersuchung,28.274858851897555
Umweltminister Sehr geehrte Kolleginnen,28.273553235684666
Bundesminister Landesverteidigung und Sport,28.267502755223475
die Hypo Alpe Adria,28.256958857427257
Inflation angepasst worden ist,28.218244947479455
und gesetzliche eines Stufenplans,28.19753853169263
Entschließungsantrag Der wolle beschließen,28.194677109180454
Christiane Brunner Kolleginnen und,28.17530331321791
als Menschenrechtsorganisation des Landes,28.17459472629296
Eva Mückstein Kolleginnen und,28.169656750076776
Darstellung der finanziellen Lage,28.168815166492585
 Kein Kind zurücklassen,28.161873987444416
Kein Kind zurücklassen ,28.161873987444416
 Präsidentin Doris Bures,28.131285667610996
ans Herz legen ,28.123193519280356
zur Entlastung des Faktors,28.096115964267398
unter Dach und Fach,28.085167225140523
