NGRAM,VALUE,
Strategische Immobilien Verwertungs- Beratungs-,0.07317073170731707
Sonja Steßl zugunsten Staatssekretariats,0.02666666666666667
Kriminaltourismus schnellst temporäre Grenzkontrollen,0.02586206896551724
Absetzbarkeit privater Kunst- Kulturausgaben,0.025
erweiterte Absetzbarkeit privater Kunst-,0.023809523809523808
Steter Tropfen höhlt Stein,0.022222222222222223
erweiterte steuerliche Absetzbarkeit privater,0.021052631578947368
erweiterte steuerliche privater Kunst-,0.020833333333333332
privater Kunst- Kulturausgaben bewirken,0.02040816326530612
erweiterte steuerliche Absetzbarkeit Kunst-,0.01834862385321101
steuerliche Absetzbarkeit privater Kunst-,0.017699115044247787
Landgut Allacher GmbH Gols,0.015037593984962405
Geschäftsräumen geschlossene Verträge erlassen,0.014925373134328358
schnellst temporäre Grenzkontrollen durchzuführen,0.014778325123152709
internen IT-Infrastruktur BIFIE gespeichert,0.0136986301369863
außerhalb Geschäftsräumen geschlossene Verträge,0.011299435028248588
automatische jährliche Wertanpassung Freibeträge,0.010638297872340425
Böse Zungen behaupten hartnäckig,0.010526315789473684
Future Business Austria Infrastrukturreport,0.010309278350515464
automatische jährliche Wertanpassung Pflegegeldes,0.010256410256410256
gesetzliche Verankerung jährlichen Anpassung,0.009478672985781991
tatsächlichen Lebenshaltungskosten jeweiligen Herkunftsland,0.009216589861751152
wichtigste Einnahmequelle Staates überholen,0.008368200836820083
Übergangsbestimmungen einzelne Herkunftsländer geschaffen,0.008064516129032258
Heinz-Christian Strache Herbert Kickl,0.007194244604316547
privaten Sponsorings zeitgenössischer Kunst,0.006578947368421052
Agrarmarkt Austria Marketing GmbH,0.006557377049180328
Dritten Präsidenten Norbert Hofer,0.006430868167202572
Spindelegger blumigen Worten dargelegt,0.006289308176100629
Abschaffung Luxuspensionen inklusive Luxuspensionskassenregelungen,0.0061162079510703364
Förderung privaten Sponsorings zeitgenössischer,0.006060606060606061
Sponsorings zeitgenössischer Kunst Kultur,0.005747126436781609
Zungen behaupten hartnäckig Faymann,0.0051813471502590676
unseres Dritten Norbert Hofer,0.005141388174807198
gleicher Lohn gleiche Arbeit,0.004932182490752158
tatsächliche Abschaffung Luxuspensionen inklusive,0.004819277108433735
Geldwäscherei- Terrorismusfinanzierungsrisiko-Verordnung Staaten aufgelistet,0.004608294930875576
allgemeine Wehrpflicht wesentlichen Beitrag,0.004608294930875576
schwache Innovationsfähigkeit unseres Landes,0.0044742729306487695
Ärzte Ärzte anstellen dürfen,0.0044603033006244425
Wissenschaft humboldtschen Sinn vernachlässigt,0.004405286343612335
ordentliche Steuer- Strukturreform fehlt,0.004219409282700422
Luxuspensionen inklusive Luxuspensionskassenregelungen öffentlichen,0.0038314176245210726
trotz geplanten budgetären Einsparungen,0.0038314176245210726
ehemaligen Finanzministers Josef Pröll,0.0036968576709796672
Form weitgehender Autonomie ausgeübt,0.0034129692832764505
Neuen Wiener Schule Nationalökonomie,0.0031201248049922
gesamten strukturellen Steuerreform zuzuleiten,0.0030211480362537764
Leben lang hart gearbeitet,0.0029895366218236174
Kriminaltourismus schnellst möglich temporäre,0.0029154518950437317
Kriminaltourismus schnellst möglich Grenzkontrollen,0.002737226277372263
schnellst möglich temporäre Grenzkontrollen,0.00273224043715847
Kriminaltourismus möglich temporäre Grenzkontrollen,0.0027272727272727275
schnellst möglich temporäre durchzuführen,0.002688172043010753
Lage zusätzliche Mittel aufzubringen,0.002638522427440633
Drittel gesamten öffentlichen Abgaben,0.002544529262086514
bundeseinheitliche Mindestsicherung derzeit geregelt,0.002544529262086514
schnellst möglich Grenzkontrollen durchzuführen,0.0025380710659898475
möglich temporäre Grenzkontrollen durchzuführen,0.002527379949452401
weiters Möglichkeit zeitlicher Befristungen,0.0025188916876574307
sowie gesamten strukturellen Steuerreform,0.002506265664160401
völlig ungeschwärzt lediglich versehen,0.0024449877750611247
Untersuchungsausschüsse Nationalrates völlig ungeschwärzt,0.002277904328018223
aufgefordert ehestmöglich entsprechende Regierungsvorlagen,0.0022271714922048997
Nationalrates völlig ungeschwärzt lediglich,0.002188183807439825
Stellungnahme Europäischen Gerichtshofes warten,0.002098635886673662
Finanzminister Spindelegger blumigen Worten,0.002034587995930824
Opposition feierte neue Revolution,0.0019723865877712033
denen jedenfalls erhöhtes Risiko,0.0019723865877712033
jahrelange wirtschaftspolitische Forderung Freiheitlichen,0.0018656716417910447
Abgabenerhöhung belastet heimischen Steuerzahler,0.0018587360594795538
Josef Pröll ehemaliger Finanzminister,0.0018248175182481751
damaligen Finanzminister Josef Pröll,0.0016835016835016834
Ärzte endlich Ärzte anstellen,0.0016565433462175593
solides Fundament stellen frei,0.0016474464579901153
Hunderttausende Euro Förderungen erhalten,0.0016207455429497568
europäischer Ebene notwendigen Maßnahmen,0.001589825119236884
durchaus logisch konsequent gedacht,0.0015698587127158557
endlich Ärzte anstellen dürfen,0.0014970059880239522
teuerste Entscheidung Zweiten Republik,0.0014255167498218105
gute zukunftsorientierte Maßnahmen setzt,0.0014064697609001407
österreichischen Gerichten rechtskräftig abgewiesen,0.0013774104683195593
sechs Mitglieder drei Vorsitzende,0.0013623978201634877
Verwunderung darüber Ausdruck verleihen,0.0013468013468013469
Mitspracherecht beim weiteren Vorgehen,0.0013175230566534915
Entscheidung Zweiten Republik getroffen,0.001287001287001287
erst wenigen Monaten beschlossen,0.0012658227848101266
wohl außer Streit gestellt,0.0012322858903265558
österreichischen Sicherheits- Verteidigungspolitik sowie,0.0012121212121212121
Österreichs Wirtschaft Fesseln liegt,0.0011799410029498525
zwei aufkommensstärksten Steuern zusammen,0.0011142061281337048
Parlament erst wenigen Monaten,0.001087547580206634
offen beim Namen nennen,0.0010626992561105207
zwei Drittel gesamten öffentlichen,0.0010465724751439038
Niederösterreich sozusagen eisenbahnfrei gemacht,0.0010126582278481013
inklusive Luxuspensionskassenregelungen öffentlichen Bereich,0.00088261253309797
Luxuspensionskassenregelungen öffentlichen Bereich beinhaltet,0.0008795074758135445
müssen Gürtel enger schnallen,0.0008633093525179857
Untersuchungsausschuss Rede Antwort stehen,0.000847816871555744
beim weiteren Vorgehen Republik,0.0008136696501220504
Dinge beim Namen nennen,0.0007974481658692185
finanzielle Situation beim Bundesheer,0.0007955449482895784
falsche Angaben gemacht hätten,0.0007911392405063291
gemeinsam dafür Sorge tragen,0.000772499034376207
leider Gottes erleben müssen,0.0007693787266782073
durchaus beim Namen nennen,0.0007636502481863307
viele wichtige richtige Anträge,0.0007513148009015778
Bundesregierung aufgefordert ehestmöglich entsprechende,0.0007168458781362007
paar Monate Zeit nehmen,0.0006487187804086928
steht klar deutlich drinnen,0.0006287331027978623
sollten dafür Sorge tragen,0.0006232471174820816
österreichische Bundesregierung aufgefordert sicherzustellen,0.000594000594000594
Prozent sowie gesamten strukturellen,0.0005602240896358543
Form unsere Zustimmung geben,0.0005549389567147614
Situation beim österreichischen Bundesheer,0.0005329070077271516
Kärnten viele Fehler gemacht,0.0005085176709890668
Gesetz unsere Zustimmung geben,0.0005001250312578145
beide Elternteile arbeiten müssen,0.00049800796812749
Ärzte müssen Ärzte anstellen,0.0004939491232403062
Zweiten Republik getroffen wurde,0.00048828125
müssen Ärzte anstellen dürfen,0.0004716981132075472
müssen endlich Ärzte anstellen,0.0004088307440719542
Ärzte müssen endlich anstellen,0.0004065867046147591
letzten Tagen präsentiert wurde,0.00039207998431680063
müssen endlich anstellen dürfen,0.0003917727717923604
Ärzte müssen endlich Ärzte,0.0003883495145631068
müssen endlich Ärzte dürfen,0.0003740415186085656
Integrität Republik Österreich sicherzustellen,0.0003127443315089914
Millionen Menschen Österreich aufgenommen,0.0003096934035305048
Österreich endlich wirksam bekämpfen,0.0002969121140142518
Asylanten Österreich überhaupt aufnehmen,0.00027177605652941976
