NGRAM,VALUE,
Generalstaatsanwältin Bundesstaatsanwalt beziehungsweise- staatsanwältin,0.14285714285714285
derived from approved biotech,0.14285714285714285
development cooperation promote readmission,0.14285714285714285
extensively tested food available,0.14285714285714285
grundlegender vertiefter Allgemeinbildung überschneidende,0.14285714285714285
harmful practices based tradition,0.14285714285714285
hochprofessionelle hochgefährliche osteuropäische Einbrecherbanden,0.14285714285714285
including development cooperation promote,0.14285714285714285
jesidischen Camp suchten verzweifelten,0.14285714285714285
tested food available today,0.14285714285714285
vertiefter Allgemeinbildung überschneidende Beurteilungsskala,0.14285714285714285
Antioxidantien Omega -Fett- säuren,0.09090909090909091
Bill Murray Andie MacDowell,0.09090909090909091
First come first serve,0.09090909090909091
José Bové Martin Häusling,0.09090909090909091
Liechtensteinischen Investmenthauses Valluga unverdächtiges,0.09090909090909091
Omega -Fett- säuren Flavonoide,0.09090909090909091
Steuertarif gleichmäßig verteilten Entlastungsvolumina,0.09090909090909091
Vermögensreport Liechtensteinischen Investmenthauses Valluga,0.09090909090909091
approved biotech crops safe,0.09090909090909091
derived approved biotech crops,0.09090909090909091
derived from approved crops,0.09090909090909091
derived from biotech crops,0.09090909090909091
extensively food crops available,0.09090909090909091
extensively tested crops available,0.09090909090909091
extensively tested food crops,0.09090909090909091
food crops available today,0.09090909090909091
from approved biotech crops,0.09090909090909091
gesamtvertraglich organisierte Einzelpraxis Auslaufmodell,0.09090909090909091
most extensively tested food,0.09090909090909091
richterlichen Befehl Internetseiten sperren,0.09090909090909091
sorgfältigen Budgetplanung Zeitgleich kündigen,0.09090909090909091
tested crops available today,0.09090909090909091
tested food crops available,0.09090909090909091
tested food crops today,0.09090909090909091
vertraglich eingeräumten Buch- Betriebsprüfungs-,0.09090909090909091
vorbeugende zivilrechtliche Immissionsabwehrklage ABGB,0.09090909090909091
baden-württembergischen Ministerpräsidentin Winfried Kretschmann,0.08333333333333333
Arnold Schwarzenegger Anna Netrebko,0.07692307692307693
Arnold Schwarzeneggers Anna Netrebkos,0.07692307692307693
Atemzug irregulärer Zuwanderung gleichgesetzt,0.06666666666666667
Ausfluss Kontrollmangels verheerenden Umfangs,0.06666666666666667
Bundesstaatsanwalt beziehungsweise- staatsanwältin einzufordern,0.06666666666666667
Fiskalregeln maßgeblichen Defizit- Schuldenquoten,0.06666666666666667
Martin Häusling Thomas Wise,0.06666666666666667
Mathematiker Carl Friedrich Gauß,0.06666666666666667
NATO-Staaten größtmögliche global denkbare,0.06666666666666667
Verband Deutscher Maschinen- Anlagenbau,0.06666666666666667
ambitious agreements have concluded,0.06666666666666667
einstürzende Neubauten einstürzende Altbauten,0.06666666666666667
forschungsumtriebigen Naturwissenschaftler Alexander Humboldt,0.06666666666666667
größtmögliche global denkbare Konfliktfall,0.06666666666666667
maßgeblichen Defizit- Schuldenquoten herausgerechnet,0.06666666666666667
most extensively food crops,0.06666666666666667
most extensively tested crops,0.06666666666666667
most tested food crops,0.06666666666666667
niedergelassene gesamtvertraglich organisierte Einzelpraxis,0.06666666666666667
niedrigst denkbaren Einkommens unterschritten,0.06666666666666667
rassistisch antisemitisch motivierten Tathandlungen,0.06666666666666667
sinnerfassende Leserinnen Leser entlässt,0.06666666666666667
zurückgetretene ukrainische Premier Asarow,0.06666666666666667
Ministerpräsidenten Baden-Württemberg Winfried Kretschmann,0.0625
Ulrike Lunacek Othmar Karas,0.058823529411764705
bekannteste Ökonom deutschsprachigen Sprachraum,0.05555555555555555
Anfechtung infolge Ergreifung Rechtsmittels,0.05263157894736842
EU-Kanada-Gipfel EU-Kommissionspräsident Manuel Barroso,0.05263157894736842
Eiserne Lady Maggie Thatcher,0.05263157894736842
Erholungsphasen individuellen Lernphasen abwechseln,0.05263157894736842
Kavalierstart startenden Motorräder hinlegen,0.05263157894736842
Medien- Religionsfreiheit essenzielle Bestandteile,0.05263157894736842
dreifachen Marktpreis garantierten Einspeisetarifen,0.05263157894736842
geschlechtergerechten Steuertarif gleichmäßig verteilten,0.05263157894736842
most ambitious agreements have,0.05263157894736842
nationale provinzielle Verengung verirren,0.05263157894736842
rot-weiß-roten Fahne ausnützen Importprodukte,0.05263157894736842
schwerwiegender Selbst- Fremdgefährdung angewendet,0.05263157894736842
Thomas Wise Ulrike Lunacek,0.047619047619047616
Ex-Sozialminister Buchinger Volksanwalt Kräuter,0.043478260869565216
Gewinnbeteiligung ver- zichten vornehm,0.043478260869565216
Robert Luschnik Wolfgang Niklfeld,0.043478260869565216
absolutistischen gigantischen Vorwürfen herumgeschwelgt,0.043478260869565216
gentechnisch verseuchter Acker umgepflügt,0.043478260869565216
kollektiven Vertuschen Verdrängen hingegeben,0.043478260869565216
renommierten Ökonomen Kurt Bayer,0.043478260869565216
schwindigkeitsdelikte schärfer rigoroser ahnden,0.043478260869565216
untere Einkommensschichten chronisch Kranke,0.043478260869565216
vorzeitige außergewöhnliche Abschreibung Restwerte,0.043478260869565216
zeitnah verfasste nachvollziehbare Dokumentationen,0.043478260869565216
ÖVP-Abgeordnete Tauschitz Handtuch geworfen,0.041666666666666664
schwarz-blauen installierte Lehrlingspapst Blum,0.038461538461538464
Centre Migration Policy Development,0.037037037037037035
Kirche Jesu Christi Heiligen,0.037037037037037035
Naturwissenschaftler Alexander Humboldt aufgemacht,0.037037037037037035
VertreterInnen die§ -Kommission entsenden,0.037037037037037035
Vorvorvorgänger Hahn Forum Alpbach,0.037037037037037035
bunte schillernde Seifenblase jegliche,0.037037037037037035
erhebliche Systemmängel finanzpolitische Schieflagen,0.037037037037037035
fünftes Buch Nikomachischen Ethik,0.037037037037037035
konventionellen makro- mikroökonomischen Ansätzen,0.037037037037037035
landwirtschaftlichen lebensmittelbezogenen Advisor Reports,0.037037037037037035
maligen orangen blauen Regierungsbeteiligung,0.037037037037037035
qualifizierten Privatanlegers geschaffenen Mindestinvestitionssumme,0.037037037037037035
siehe Baden-Württemberg Baden- Württemberg,0.037037037037037035
späteren forschungsumtriebigen Naturwissenschaftler Alexander,0.037037037037037035
überwiegenden Polizeialltag passende Werkzeug,0.037037037037037035
Abschnitt VIII Bundesgesetzes BGBl,0.03571428571428571
Eugen Freund Ulrike Lunacek,0.034482758620689655
Finanzierungsbeitrages Green Climate Fund,0.034482758620689655
Ausbildungsgarantie die- pflicht nutzt,0.03225806451612903
Genfer Flüchtlingskonvention bestmöglicher Wirksamkeit,0.03225806451612903
Vermieter preist funktionierende Therme,0.03225806451612903
argentinische Pferde irgendeinem Verarbeitungsprodukt,0.03225806451612903
beantragte Stilllegung Bahnstrecke Friedberg,0.03225806451612903
einfachste permanent wirksamste Kontrollrecht,0.03225806451612903
erhebliches Gesundheitsrisiko Weltweit sterben,0.03225806451612903
externe Ratings aggressive AIFMs,0.03225806451612903
implementierten Konzernklagsrechte verschlimmern perpetuieren,0.03225806451612903
unfassbare zynische Elend siegt,0.03225806451612903
mutmaßlich unangemessener Polizeigewalt Sonderstaatsanwaltschaft,0.03125
abbaubare ökologisch unbedenkliche Inhaltsstoffe,0.030303030303030304
leitenden Angestellten geschäftsführenden leitenden,0.030303030303030304
freier Trägerschaft konfessionellen Privatschulen,0.029411764705882353
Baden- Württemberg grün regiert,0.02857142857142857
Buchstabentage betreut Brote geschmiert,0.02857142857142857
Gutachtens Beratungsfirma Oliver Wyman,0.02857142857142857
Investitionsschutz investor-state dispute settlements,0.02857142857142857
Judikatur entwickelte Sammelklage österreichischem,0.02857142857142857
Kontrollmangels verheerenden Umfangs Trotz,0.02857142857142857
bildungsnahen Schichten entsprechendem familiären,0.02857142857142857
flächenungebundenen Tierhaltung Riegel vorzuschieben,0.02857142857142857
glücklicherweise Professorin Claudia Unger,0.02857142857142857
hervorragende Komödie Bill Murray,0.02857142857142857
internationalem Gebiet Lächerlichkeit preis,0.02857142857142857
medizinisch begründeter Ausnahmefälle erforderlich,0.02857142857142857
oberösterreichische Bildungslandesrätin Doris Hummer,0.02857142857142857
präventiv E-Mail-Kontakte Telefonkontakte sammeln,0.02857142857142857
sonderpädagogischem Förderbedarf inklusiven Unterricht,0.02857142857142857
stehende großkriminelle Organisation Mogilevich,0.02857142857142857
biologisch abbaubare ökologisch unbedenkliche,0.027777777777777776
hormonell wirkende Chemikalien ersetzen,0.027777777777777776
imponierend Sven Giegold beschreibt,0.027777777777777776
nationalreligiösen Organisation Millî Görüş,0.02702702702702703
sinnlose Generalisierungen sinnlose Generalvorwürfe,0.02702702702702703
sinnlose Generalvorwürfe sinnlose Rechtfertigungen,0.02702702702702703
Budgetnot Gratiszeitungen großzügig inserieren,0.02564102564102564
Bürgerkrieg zerrissenes Heimatland zurückgeschoben,0.02564102564102564
Entzug fruchtbarer Böden Ankauf,0.02564102564102564
Groß schlägt Klein Talbetrieb,0.02564102564102564
Gutachtern katastrophales Zeugnis ausstellt,0.02564102564102564
Image rot-weiß-roten Fahne ausnützen,0.02564102564102564
Judith Neyer Lukas Hammer,0.02564102564102564
Klein Talbetrieb schlägt Bergbetrieb,0.02564102564102564
Linzer Lokal- oberösterreichischen Regionalverkehrspolitik,0.02564102564102564
Resultaten führenden Nachdenkprozess mitten,0.02564102564102564
Rücksichtnahme psychisch belastende Arbeitssituationen,0.02564102564102564
Verbrauchsteuern Tabak- Alkoholabgaben belasten,0.02564102564102564
Zellen zugesperrt Lange Einschlusszeiten,0.02564102564102564
begründeter Ausnahmefälle erforderlich angezeigt,0.02564102564102564
echtes rechtsstaatliches verfassungsrecht-liches Rechtsschutzdefizit,0.02564102564102564
großkriminelle Organisation Mogilevich Tapet,0.02564102564102564
psychosoziale Ver- sorgung Palliativversorgung,0.02564102564102564
unterstütztes sanktioniertes Spionagewesen mitten,0.02564102564102564
Hypo-Aufsichtsratschef Johannes Ditz Handtuch,0.025
Wasserleitungen fließt bestes Quellwasser,0.025
fließt bestes Quellwasser Mineralwasserqualität,0.025
frühe Hilfen psychischen Erkrankungen,0.025
Angestellten geschäftsführenden leitenden Angestellten,0.024390243902439025
Verkauf Liegenschaft Roßauer Lände,0.023809523809523808
Antennenanlagen Special Collection Service,0.023255813953488372
Beispielsweise Doing Business Report,0.023255813953488372
Gegenoffensive dröhnendes Schweigen angesagt,0.023255813953488372
Pensionsversicherung Gewerblichen Sozialversicherungsgesetz abzusenken,0.023255813953488372
Persönlichkeiten hochgiftigen Papieren spekulieren,0.023255813953488372
Report World Economic Forum,0.023255813953488372
Verkehrssystem gezielt umzulenken umzusteuern,0.023255813953488372
kaufmännischer Direktor Hamburger Schauspielhauses,0.023255813953488372
käfigähnliche Unterbringungen psychisch kranke,0.023255813953488372
legitimen Sicherheitsinteressen Russlands aussehen,0.023255813953488372
makro- mikroökonomischen Ansätzen vernachlässigt,0.023255813953488372
medizinisch unterstützten Fortpflanzung erhoben,0.023255813953488372
technisch hochgerüsteten Geheimdiensten mithalten,0.023255813953488372
voneinander trennt Große Infrastrukturprojekte,0.023255813953488372
Regierungspartner unterm Hintern weggezogen,0.022727272727272728
heiße Kartoffeln hin- hergeschickt,0.022727272727272728
verbindliche verpflichtende Qualitätsstandards festzuschreiben,0.022727272727272728
Andrej Kljujew Geldwäsche verdächtigt,0.022222222222222223
Green Climate Fund einlösen,0.022222222222222223
Sigrid Maurer Alev Korun,0.022222222222222223
ökologisch unbedenkliche Inhaltsstoffe umgestellt,0.022222222222222223
Rotes Kreuz Roter Halbmond,0.021739130434782608
Agenten Regierungszentren diplomatische Zentren,0.02127659574468085
Hektar verseuchter Acker umgepflügt,0.02127659574468085
International Centre Migration Policy,0.02127659574468085
Kooperationen mehrerer Hochschulen ausländischen,0.02127659574468085
Leitungen mithilfe Bundesnachrichtendienstes ausspäht,0.02127659574468085
Parteiakademien unterschiedlicher Nuancierung geübt,0.02127659574468085
Terezija Stoisits Andreas Wabl,0.02127659574468085
entlang normaler wirtschaftspolitischer Indikatoren,0.02127659574468085
kurzen Leine lokalen SPÖ-Politik,0.02127659574468085
mangelnde Wertberichtigungen mangelnde Abschreibungen,0.02127659574468085
mehrerer Hochschulen ausländischen Hochschulen,0.02127659574468085
registrieren ausländische Studiengänge problemlos,0.02127659574468085
unwürdige Kasperltheater diverse Kompromisslösungen,0.02127659574468085
vorderste Kämpferin Sexismus aufzuspielen,0.02127659574468085
Soziologen Manfred Krenn angesehen,0.020833333333333332
Bundesbesitz befindlichen Gesellschaften erstreckt,0.02040816326530612
jeweils Summenbeträgen sämtlicher Anlagen,0.020202020202020204
Minimierung zukünftigen Hypo-SteuerzahlerInnenschadens bekennt,0.02
verantwortungsloser amerikanischer NATO-Politik aussehen,0.02
Arbeitszimmer Wohnungsverband steuerlich geltend,0.0196078431372549
Bahnstrecke Friedberg Oberwart abzuwenden,0.0196078431372549
Bezirk Tulln herumstehen Regionalverantwortlicher,0.0196078431372549
Gesinnungsgenossen Justizvollzug Beamtinnen belästigen,0.0196078431372549
Hitlergruß Bezirk Tulln herumstehen,0.0196078431372549
Know-how ständigen Übens besitzen,0.0196078431372549
Korrupte Systeme fressen Zukunftsspielraum,0.0196078431372549
Pressespiegel Einstellung Meischberger ausheben,0.0196078431372549
Saddam biochemischen Waffen vergast,0.0196078431372549
Summenbeträgen sämtlicher Anlagen berücksichtigen,0.0196078431372549
Verkaufs gentechnisch behandelten Lebensmitteln,0.0196078431372549
integrierte Versorgungseinrichtungen multiprofessionelle Teams,0.0196078431372549
realistische Erwartungshaltung realistische Umsetzungsmöglichkeiten,0.0196078431372549
tonnenweise gefälschte Pflanzenschutzmittel China,0.0196078431372549
transparente Neuregelung klinischen Mehraufwandes,0.0196078431372549
Johannes Ditz Handtuch geworfen,0.018867924528301886
ökologisch unbedenkliche Inhaltsstoffe bewirken,0.018867924528301886
Einzelne schreckliche Schicksale verkraften,0.01818181818181818
Falls Berliner Mauer gefeiert,0.01818181818181818
Gefährdet gesetzlicher existenzsichernder Mindestlohn,0.01818181818181818
Genossenschaften zusammenschließen eigenständige Marken,0.01818181818181818
Kalendersprüchen maximal Hergottswinkel tapezieren,0.01818181818181818
Qualitätssicherung medizinisch unterstützten Fortpflanzung,0.01818181818181818
Vorwand Terrorismusbekämpfung BürgerInnenrechte eingeschränkt,0.01818181818181818
angebliches Partizipationskapital hineinlegen solltet,0.01818181818181818
ganzes Kartenhaus seltsamen Argumentationen,0.01818181818181818
geplanten Einzelbaum-Digitalisierung vereinfachte Bio-Diversitätsmaßnahme,0.01818181818181818
gesetzlicher existenzsichernder Mindestlohn Kollektivvertragssystem,0.01818181818181818
ideologische Schranken sonstige Zwänge,0.01818181818181818
militärische völkerrechtswidrige Aggression gefolgt,0.01818181818181818
quälender Scham anstrengenden Bemühungen,0.01818181818181818
solidarische Sozialversicherungssystem schrittweise aufzugeben,0.01818181818181818
unermessliches seelisches Leid enorme,0.01818181818181818
verteilungspolitische Fragestellungen Dementsprechend ernüchternd,0.01818181818181818
Breyer Abteilungsleiter Johannes Turner,0.017857142857142856
EU-weites ökologisches Wachstumspaket kurzer,0.017857142857142856
interreligiösen Dialog stiftet steuert,0.017857142857142856
risikobasierte Bewertungen verschiedener Optionen,0.017857142857142856
unangemessener Polizeigewalt Sonderstaatsanwaltschaft samt,0.017857142857142856
großkriminelle Mogilevich aufs Tapet,0.017241379310344827
interkulturellen interreligiösen Dialog stiftet,0.017241379310344827
-RRB- rasche Verabschiedung Stufenplans,0.01694915254237288
Förderbedarf inklusiven Unterricht verwirklicht,0.01694915254237288
Gutheißen terroristischer Straftaten strafbar,0.01694915254237288
Haushalten bestem Quellwasser versorgen,0.01694915254237288
Intellekt Gewissen eingeschaltet vorausgesetzt,0.01694915254237288
edel Christlichsoziale Grundwerte lauten,0.01694915254237288
fundierten dokumentierten journalistischen Berichten,0.01694915254237288
geplanten ungarischen Kernkraftwerkserweiterung Paks,0.01694915254237288
hochwertigen erschwinglichen Kinderbetreuungseinrichtungen erweitert,0.01694915254237288
lokale regionale Umfahrungsprojekt realisieren,0.01694915254237288
seelisches Leid enorme volkswirtschaftliche,0.01694915254237288
Vereinigten Hillary Clinton angeordnet,0.016666666666666666
heiße Kartoffeln EU-Ländern hin-,0.016666666666666666
natürliches artgerechtes Verhalten auszuleben,0.016666666666666666
plötzlichem Kindstod verstirbt endet,0.016666666666666666
Banken- Finanzsektor aufzubauenden Fonds,0.015873015873015872
EU-Programm namens Triton gestartet,0.015873015873015872
Finanzsektor aufzubauenden Fonds hingegriffen,0.015873015873015872
Hektar gentechnisch Acker umgepflügt,0.015873015873015872
Hektar gentechnisch verseuchter Acker,0.015873015873015872
Hektar gentechnisch verseuchter umgepflügt,0.015873015873015872
Insider sogenanntes Backdoor eingebaut,0.015873015873015872
Investitionsverpflichtung begünstigte Wertpapiere vorsieht,0.015873015873015872
Millionäre berät Vermögensforschung betreibt,0.015873015873015872
Tankern Bundesmuseen Salzburger Festspiele,0.015873015873015872
besonderen betriebsbedingten Belastungen Krisensituationen,0.015873015873015872
entscheidenden dominanten Knoten Frankfurt,0.015873015873015872
kommenden EU-Kanada-Gipfel EU-Kommissionspräsident Manuel,0.015873015873015872
kommenden EU-Kanada-Gipfel Manuel Barroso,0.015873015873015872
kommenden EU-Kommissionspräsident Manuel Barroso,0.015873015873015872
startenden Motorräder hinlegen produzieren,0.015873015873015872
stattdessen EU-Programm namens Triton,0.015873015873015872
stehende großkriminelle Mogilevich aufs,0.015873015873015872
Schmidt besitzt NFC-fähige Bankomatkarte,0.015625
Tilo Berlin Veit Sorger,0.015625
Verbindungen qualitativ hochwertige Verbindungen,0.015625
ausnehmend noble sachliche Feststellung,0.015625
effektiven Arbeitsmarktzugang Asylsuchende vorzusehen,0.015625
schwerst verletzt schwerst gedemütigt,0.015625
Österreichern reinen Wein einzuschenken,0.015625
multiprofessionelle Personalressourcen Neuen Mittelschulen,0.015384615384615385
Kommissarin Fischer Boel übergeben,0.014925373134328358
Putin Standing Ovations gespendet,0.014925373134328358
Rechtsanwälte übergeordnete Instanz vorzusehen,0.014925373134328358
Standardisierte Reife- Diplomprüfung spätestens,0.014925373134328358
Tabak- Alkoholabgaben belasten namentlich,0.014925373134328358
Volksgruppen Barbara Prammer hinterlässt,0.014925373134328358
afro-asiatischen Institutes Graz entdeckt,0.014925373134328358
außerhalb medizinisch begründeter Ausnahmefälle,0.014925373134328358
besitzt professionell organisiertes Immobilienunternehmen,0.014925373134328358
