NGRAM,VALUE,
Strategische Immobilien Verwertungs- Beratungs-,0.07317073170731707
Best Point of Service,0.0410958904109589
sehr geehrten Damen Herren,0.03708191953465827
Meine sehr geehrten Damen,0.027728085867620753
F & E- Quote,0.02702702702702703
Der Nationalrat wolle beschließen,0.026201984227931824
Kriminaltourismus schnellst temporäre Grenzkontrollen,0.02586206896551724
schnellst temporäre Grenzkontrollen durchzuführen,0.014778325123152709
Doris Bures Als Nächster,0.014326647564469915
Sehr geehrte Frau Präsidentin,0.01327812678469446
meine sehr geehrten Damen,0.012836079791847355
Doris Bures Als Nächste,0.01272264631043257
Sehr geehrter Herr Präsident,0.012598676341599554
Nationalrat wolle zweiter Lesung,0.009821428571428571
sehr Damen und Herren,0.00886482721501955
Sehr geehrte Damen Herren,0.008232872684504558
wolle zweiter Lesung beschließen,0.008130081300813009
geehrten Damen und Herren,0.007796045927033086
sehr geehrten Damen und,0.007349526844186828
sehr geehrten und Herren,0.007344822620133455
Präsidentin Doris Bures Als,0.007173601147776184
sehr verehrten Damen Herren,0.0070308711815096165
folgenden Antrag einbringen Entschließungsantrag,0.005991440798858773
Meine sehr Damen und,0.005704713895166006
Hohes Haus Werte Zuseherinnen,0.005552128315854411
et cetera et cetera,0.005385996409335727
Meine geehrten Damen und,0.005272646868728101
Meine sehr geehrten und,0.0049519184690584965
gleicher Lohn gleiche Arbeit,0.004932182490752158
Abgeordneter Durchführung temporärer Grenzkontrollen,0.004777070063694267
geehrte Frau Präsidentin Sehr,0.004713892889878225
geehrter Herr Präsident Sehr,0.004702436016034536
Sehr geehrter Herr Bundesminister,0.004686318972033258
Ärzte Ärzte anstellen dürfen,0.0044603033006244425
Herr Präsident Herr Bundesminister,0.00445145135862005
Meine sehr verehrten Damen,0.004384395132426629
Frau Präsidentin Sehr geehrter,0.004167824395665463
Durchführung temporärer Grenzkontrollen Nationalrat,0.004162330905306972
Als Nächster Wort gemeldet,0.004073319755600814
betreffend Durchführung temporärer Grenzkontrollen,0.003948667324777887
Herr Präsident Sehr geehrte,0.003838476892369108
Kärnten Dr Peter Kaiser,0.0038138825324180014
temporärer Grenzkontrollen Nationalrat wolle,0.00375234521575985
Herr Bundesminister Hohes Haus,0.003741471645513902
Herr Präsident Herr Minister,0.0036716249293918283
betreffend Versagen Vertrauens gegenüber,0.0036101083032490976
Strache Dr Walter Rosenkranz,0.0035629453681710215
Herr Präsident Sehr geehrter,0.003536829155774258
meine sehr verehrten Damen,0.00329689397883047
Abgeordneten DDr Hubert Fuchs,0.003257328990228013
Präsident Sehr geehrter Herr,0.003244692106933766
Der Nationalrat wolle zweiter,0.0030977189524077726
weiterer Abgeordneter Durchführung temporärer,0.003083247687564234
vollen Kindererziehungszeit pro Kind,0.0030272452068617556
Sehr geehrte Kolleginnen Kollegen,0.002968460111317254
meine sehr Damen und,0.0029628003950400526
bringe daher folgenden Antrag,0.0029505778214900416
Als Nächste Wort gelangt,0.0029498525073746312
Landeshauptmann Dr Peter Kaiser,0.002932551319648094
Hubert Fuchs weiterer Abgeordneter,0.0029211295034079843
Kriminaltourismus schnellst möglich temporäre,0.0029154518950437317
Frau Präsidentin Sehr geehrte,0.0028937577511368336
Kriminaltourismus schnellst möglich Grenzkontrollen,0.002737226277372263
schnellst möglich temporäre Grenzkontrollen,0.00273224043715847
Kriminaltourismus möglich temporäre Grenzkontrollen,0.0027272727272727275
vier vollen Kindererziehungszeit pro,0.0027223230490018148
schnellst möglich temporäre durchzuführen,0.002688172043010753
in den letzten Jahren,0.00267472748923697
Grenzkontrollen Nationalrat wolle beschließen,0.0026578073089701
Nationalrat wolle beschließen ‚,0.0026367831245880024
Minister Meine sehr geehrten,0.002593909117110193
Meine Damen und Herren,0.0025913190810783874
Entschließungsantrag Abgeordneten Dr Rosenkranz,0.00255863539445629
schnellst möglich Grenzkontrollen durchzuführen,0.0025380710659898475
möglich temporäre Grenzkontrollen durchzuführen,0.002527379949452401
meine geehrten Damen und,0.0025030019110757833
darf folgenden Antrag einbringen,0.002447708055184691
folgenden Antrag ein Entschließungsantrag,0.002411530480623633
Die Bundesregierung wird aufgefordert,0.0024064756070881644
Präsidentin Sehr geehrter Herr,0.002369668246445498
B-VG durch ausdrückliche Entschließung,0.002364066193853428
meine sehr geehrten und,0.0023450373938395234
Zanger weiterer Abgeordneter betreffend,0.0023014959723820483
Präsident Meine sehr geehrten,0.0022996964400699106
Abgeordneter betreffend Durchführung temporärer,0.002276176024279211
durch ausdrückliche Entschließung Nationalrates,0.002274450341167551
Antrag Einsetzung eines Untersuchungsausschusses,0.0022652388797364084
Herr Präsident Hohes Haus,0.002240074154178897
Damen und Herren ,0.00223421207647952
meine Damen und Herren,0.0021952801476824825
Abgeordneter betreffend temporärer Grenzkontrollen,0.002173913043478261
Präsident Sehr geehrte Frau,0.0021729682746631897
Abgeordneter betreffend Durchführung Grenzkontrollen,0.002150537634408602
Abgeordneter betreffend Versagen Vertrauens,0.002117148906139732
weiterer Abgeordneter Nationalrat wolle,0.0021152829190904283
Herr Minister Hohes Haus,0.0021008403361344537
hier im Hohen Haus,0.002079707992020712
bringe folgenden Antrag ein,0.002058319039451115
Licht ins Dunkel kommt,0.002050020500205002
weiterer betreffend Durchführung temporärer,0.0020491803278688526
vier vollen Jahren Kindererziehungszeit,0.0020325203252032522
Anrechnung vier vollen Jahren,0.002027027027027027
Dr Karlsböck weiterer Abgeordneter,0.0019569471624266144
Präsidentin Meine sehr geehrten,0.0019365250134480904
Präsident Sehr geehrte Damen,0.0019230769230769232
Landeshauptmann Kärnten Dr Peter,0.0019169329073482429
bis einem gewissen Grad,0.0018844221105527637
Licht ins Dunkel bringen,0.0018633540372670807
geehrter Herr Präsident Herr,0.0018609206660137121
Entschließungsantrag Nationalrat wolle beschließen,0.0018578727357176034
Frau Präsidentin Hohes Haus,0.0018103328227266396
Herr Bundesminister Werte Kolleginnen,0.0017781213761113258
Entschließungsantrag Abgeordneten Dr Karlsböck,0.0017414018284719198
weiterer Abgeordneter betreffend temporärer,0.0017401392111368909
weiterer Abgeordneter betreffend Durchführung,0.0017301038062283738
Frau Staatssekretärin Hohes Haus,0.0017298544039210033
mehr Netto vom Brutto,0.001724385687598793
Karlsböck weiterer Abgeordneter betreffend,0.0017211703958691911
Sehr geehrter Herr Minister,0.0017019959771004177
Entschließungsantrag Abgeordneten Carmen Schimanek,0.0016997167138810198
Podgorschek weiterer Abgeordneter betreffend,0.0016939582156973462
Abgeordneten Dr Walter Rosenkranz,0.001693002257336343
Präsidentin Sehr geehrte Frau,0.0016911669051645636
Kunasek weiterer Abgeordneter betreffend,0.0016882386043894203
Rosenkranz weiterer Abgeordneter betreffend,0.0016611295681063123
bin fest davon überzeugt,0.0016572754391779914
Ärzte endlich Ärzte anstellen,0.0016565433462175593
Abgeordneten Kickl Dr Belakowitsch-Jenewein,0.0016492578339747114
weiterer Abgeordneter betreffend Versagen,0.0016339869281045752
Frau Präsidentin Guten Morgen,0.0016181229773462784
Sehr geehrte Frau Bundesminister,0.0016160310277957336
Herr Minister Meine sehr,0.0016109112387907426
weiterer Abgeordneter betreffend Einführung,0.0015915119363395225
geehrte Damen und Herren,0.001568587765015433
Herr Minister Sehr geehrte,0.0015651785048818663
Hohes Haus Sehr geehrte,0.0015467904098994587
Herr Präsident Meine sehr,0.0015347511510633632
Sehr geehrte Frau Minister,0.0015140927090612625
Abgeordneter Der Nationalrat wolle,0.0015113350125944584
Zeitpunkt Verstaatlichung ohne Not,0.0015113350125944584
endlich Ärzte anstellen dürfen,0.0014970059880239522
Anträge Einsetzung eines Untersuchungsausschusses,0.0014942099364960778
verehrten Damen und Herren,0.0014874846122281493
Hohes Haus Werte Kolleginnen,0.0014655593551538837
Abgeordneten Themessl weiterer Abgeordneter,0.0014612761811982464
auf Einsetzung eines Untersuchungsausschusses,0.0014582853634200628
Frau Präsidentin Meine sehr,0.0014423076923076924
Da frage ich mich,0.0014377456148758746
Sehr geehrte und Herren,0.0014261744966442952
Einsetzung eines Untersuchungsausschusses zustimmen,0.001418942887548776
Sehr geehrte Damen und,0.0014133086565155213
weiterer Abgeordneter Der Nationalrat,0.0014048232264106766
sehr verehrten und Herren,0.0014005827712220487
Daher bringe folgenden Antrag,0.001397428731134712
sehr verehrten Damen und,0.0013931367996284968
Sehr Damen und Herren,0.0013906594043342217
geehrte Frau Präsidentin Herr,0.0013812154696132596
dem Nationalrat Regierungsvorlage zuzuleiten,0.001377994488022048
Hohes Haus Meine sehr,0.0013580366669900088
Abgeordneten Dr Karlsböck weiterer,0.0013464991023339318
Ich bringe folgenden Antrag,0.0013386880856760374
Durchführung temporärer Grenzkontrollen Der,0.0013328890369876708
Sehr geehrte Frau Staatssekretärin,0.0013313609467455621
Pflege eines behinderten Kindes,0.0013309671694764862
Minister Sehr geehrte Damen,0.001328609388839681
Ich daher folgenden Antrag,0.00132244262932711
wird aufgefordert dem Nationalrat,0.001321272487041366
Herr Präsident Frau Minister,0.0013185495954450106
Frau Präsidentin Herr Bundesminister,0.0013135672734096453
Entschließungsantrag Abgeordneten Dr Walter,0.0012987012987012987
Frau Ministerin Hohes Haus,0.001291804219893785
Frau Präsidentin Herr Minister,0.0012746972594008922
Ich bringe daher folgenden,0.0012191690893744724
Guten Morgen Frau Präsidentin,0.001213837750354036
Deshalb bringe folgenden Antrag,0.0012124886329190664
Werte Kolleginnen und Kollegen,0.0012086887453810822
Herr Präsident Frau Bundesminister,0.0012071740630029892
temporärer Grenzkontrollen Der wolle,0.0012004801920768306
geehrte Frau Präsidentin Hohes,0.0011945647304763326
geehrten Damen Herren auf,0.0011861117101574293
 sehr geehrten Damen,0.0011857553339487473
Herr Präsident des Rechnungshofes,0.0011856003449019184
Hohes Haus Werte Zuseher,0.0011851851851851852
Durchführung temporärer Der Nationalrat,0.0011788977306218685
sage Ihnen ganz ehrlich,0.001162422064884286
temporärer Grenzkontrollen Der Nationalrat,0.0011580775911986102
Regierungsbank Meine sehr geehrten,0.0011576753878212549
Durchführung Grenzkontrollen Der Nationalrat,0.0011530700490054772
temporärer Der Nationalrat wolle,0.0011441647597254005
Grenzkontrollen Der Nationalrat wolle,0.0011198208286674132
Kollegen Der Nationalrat wolle,0.0011011194714626537
Grenzkontrollen Der wolle beschließen,0.0010893246187363835
Abgeordneten Dr Rosenkranz Kolleginnen,0.0010857763300760044
Einsetzung eines Untersuchungsausschusses gestellt,0.0010845986984815619
 Herr Präsident ,0.0010808273318603722
Herr Präsident Meine Damen,0.001072833472404339
vollen Jahren Kindererziehungszeit jedes,0.0010718113612004287
 Sehr geehrter Herr,0.0010682483326488919
Frau Präsidentin Frau Bundesministerin,0.0010656436487638534
wahrsten Sinne des Wortes,0.001065340909090909
geehrten Damen Herren ,0.0010649040668319104
Frau Bundesminister Hohes Haus,0.0010612331529236973
betreffend Durchführung temporärer Der,0.0010587612493382743
Damen und Herren der,0.0010573569785560584
Kollegen betreffend Versagen Vertrauens,0.001054481546572935
vollen Jahren Kindererziehungszeit Kind,0.0010485844110450892
Herren auf der Regierungsbank,0.001045494380467705
betreffend temporärer Grenzkontrollen Der,0.001041938004688721
betreffend Durchführung Grenzkontrollen Der,0.0010378827192527244
 Damen und Herren,0.0010372575468626448
einer Verstaatlichung ohne Not,0.0010358094110683633
gebe Ihnen vollkommen recht,0.0010354110581901014
geehrte Frau Präsidentin Meine,0.00103132654376692
nach bestem Wissen Gewissen,0.0010245901639344263
wenn es darum geht,0.0010206896551724137
Herr Bundesminister Sehr geehrte,0.0010204081632653062
geehrter Herr Bundesminister Hohes,0.001019607843137255
Frau Präsidentin Herr Bundeskanzler,0.0010140616549486209
Bundesregierung wird aufgefordert dem,0.0010119018937021153
Hohes Haus Zu Beginn,0.0010114632501685772
Bundesminister Sehr geehrte Damen,0.0010067451927917043
Grenzkontrollen Der Nationalrat beschließen,0.0010012515644555694
Jahren Kindererziehungszeit jedes Kind,0.0009946949602122016
stelle daher folgenden Antrag,0.0009918175055789735
in diesem Hohen Haus,0.0009872437712712063
weiterer Der Nationalrat wolle,0.0009871668311944718
daher folgenden Antrag einbringen,0.000986679822397632
Bundesminister Meine sehr geehrten,0.0009673731422038519
weiterer Abgeordneter Der wolle,0.000963623223319682
Kolleginnen und Kollegen betreffend,0.0009632917053703512
bringe ich folgenden Antrag,0.0009570455441085402
geehrten und Herren ,0.0009541513810518696
geehrter Herr Bundesminister Sehr,0.0009509875640087783
vollen Jahren Kindererziehungszeit pro,0.000949667616334283
gebe ich Ihnen recht,0.0009484666455896301
Entschließungsantrag Der Nationalrat wolle,0.0009478672985781991
frage ich mich schon,0.0009477110717376077
geehrten Damen und ,0.000943602329721614
auf der anderen Seite,0.0009401940943062483
dann frage ich mich,0.0009308906761989872
 Meine sehr Damen,0.000930312330276469
erst vor wenigen Wochen,0.0009297136481963555
Entschließungsantrag Der wolle beschließen,0.000925925925925926
Damen und Herren auf,0.0009166569665929462
geehrter Herr Präsident Meine,0.0009155413138017853
geehrter Herr Präsident Hohes,0.0009124087591240876
Damen Herren auf der,0.0009105996739465684
Frau Präsidentin Meine Damen,0.0009084302325581395
zur Einsetzung eines Untersuchungsausschusses,0.0009062896501721951
Bundesministerin Inneres wird aufgefordert,0.0009029345372460496
über Tisch ziehen lassen,0.0008963786303334528
dem Nationalrat eine Regierungsvorlage,0.0008953280156275436
Jahren Kindererziehungszeit pro Kind,0.000892325996430696
Präsidentin Sehr geehrte Damen,0.000891492613346918
Kollegen Nationalrat wolle beschließen,0.0008846947803007962
Haus Sehr geehrte Damen,0.0008846621696339711
In diesem Sinne ich,0.0008787752647888626
vollen Jahren pro Kind,0.0008751458576429405
vier Jahren Kindererziehungszeit pro,0.0008743806470416788
sollen vom ersten Tag,0.0008680555555555555
Aus diesem Grund bringe,0.0008656509695290858
müssen Gürtel enger schnallen,0.0008633093525179857
Daher meine Frage /M,0.0008631851532153647
Entschließungsantrag Der Nationalrat beschließen,0.0008615119534783546
Ich bringe daher Antrag,0.0008598452278589854
Nationalrat eine Regierungsvorlage zuzuleiten,0.0008550662676357417
vier vollen Jahren pro,0.0008488964346349745
von SPÖ und ÖVP,0.000840153937882812
Meine verehrten Damen und,0.0008389261744966443
In diesem Sinne darf,0.0008365200764818356
Kolleginnen Kollegen betreffend Versagen,0.0008305647840531562
 Meine sehr geehrten,0.0008283510326950414
Sehr geehrte Mitglieder Bundesregierung,0.0008269588587967748
Hohes Haus Geschätzte Damen,0.0008269018743109151
Kolleginnen Kollegen betreffend Einführung,0.000819000819000819
gleich folgenden Antrag einbringen,0.0008149959250203749
Kolleginnen Kollegen Der Nationalrat,0.0008136696501220504
aufgefordert dem Nationalrat eine,0.0008086035416835126
 Meine geehrten Damen,0.000806542716551465
Antrag auf Einsetzung Untersuchungsausschusses,0.0008037410492474061
gleich Beginn folgenden Antrag,0.0008032128514056225
werte Damen und Herren,0.0008030344450519409
Frau Minister Hohes Haus,0.000802108399220809
bringe daher folgenden ein,0.000797643882684992
Zusammenhang bringe folgenden Antrag,0.0007968127490039841
Minister Meine sehr verehrten,0.0007957823535263105
geehrter Herr Präsident Mitglieder,0.0007933010136624063
Aber meine sehr geehrten,0.0007915567282321899
Herr Präsident Frau Bundesministerin,0.0007874532449635803
Meine sehr verehrten und,0.0007874521904027255
geehrter Herr Präsident Frau,0.000782472613458529
doch völlig falsche Weg,0.0007731958762886598
Werte Zuseherinnen Zuseher auf,0.0007718696397941681
leider Gottes erleben müssen,0.0007693787266782073
und Herren auf Regierungsbank,0.0007672558798359253
Haus Meine sehr geehrten,0.0007649646203863071
B-VG ausdrückliche Entschließung des,0.0007643312101910828
ausdrückliche Entschließung des Nationalrates,0.0007627765064836003
möchte folgenden Antrag einbringen,0.0007614696363982486
jährliche Wertanpassung des Pflegegeldes,0.0007553820974442906
